{
  "schemaVersion": 1,
  "id": "stemi_anterior_001",
  "version": 1,
  "metadata": {
    "title": "Crushing chest pain in a 54-year-old",
    "clinicalVersion": "0.1-draft",
    "chiefComplaint": "Severe central chest pain for the last 90 minutes",
    "specialty": "emergency_medicine",
    "estimatedMinutes": 10,
    "authors": ["qaniva-clinical-content (AI-assisted, evidence-ledger-backed)"],
    "clinicalReview": {
      "status": "mvp_demo_approved",
      "reviewer": null,
      "date": null,
      "notes": "MVP DEMO APPROVED by the project owner for INTERNAL/DEMO educational use only. CLINICAL VALIDATION: PENDING — no clinician has completed docs/clinical/cases/stemi/REVIEW.md. Every clinical value traces to docs/clinical/cases/stemi/evidence.yaml (EV-… ids in evidenceRefs) and retains its review-pending provenance. This case must not be represented as clinically approved."
    },
    "fictional": true
  },
  "learningObjectives": [
    "Obtain a 12-lead ECG within 10 minutes of arrival for acute chest pain and identify the need for emergent reperfusion (EV-STEMI-010, EV-STEMI-014)",
    "Initiate guideline-based initial medical therapy — aspirin loading plus appropriate adjuncts — without delaying reperfusion (EV-STEMI-030, EV-STEMI-031)",
    "Select primary PCI and activate the cath lab within the target window at a PCI-capable center (EV-STEMI-020, EV-STEMI-021)",
    "Avoid non-indicated and harmful interventions: routine oxygen at normal SpO2, NSAID analgesia, fibrinolysis when primary PCI is immediately available (EV-STEMI-033, EV-STEMI-038, EV-STEMI-023)",
    "Maintain monitoring and access appropriate for early VF risk (EV-STEMI-013, EV-STEMI-016)"
  ],
  "presentationProfile": {
    "roomKey": "ed_resus_v1",
    "patientVariant": "adult_rigged_v1",
    "animationStateAtStart": "distress_mild",
    "monitorLayout": "ed_standard",
    "requiredProps": ["iv_pole", "crash_cart", "defib_pads"],
    "cameraPreset": "bedside_01",
    "audioProfile": "room_ambience_low"
  },
  "patient": {
    "displayName": "Kemal A. (fictional)",
    "ageYears": 54,
    "sex": "male",
    "weightKg": 86,
    "persona": "in severe pain, pale and sweaty, anxious, answers in short sentences",
    "backgroundFacts": [
      "Walked into triage with severe central chest pain",
      "The pain started about 90 minutes ago, at rest"
    ]
  },
  "initialState": {
    "vitals": {
      "hr": 96,
      "sbpMmHg": 118,
      "dbpMmHg": 76,
      "spo2": 96,
      "rrPerMin": 18,
      "tempC": 36.8
    },
    "rhythm": "sinus_rhythm",
    "airway": "patent",
    "breathing": "spontaneous",
    "circulation": "poor_perfusion",
    "neuro": "alert",
    "painScore": 8,
    "flags": []
  },
  "hiddenFacts": [
    {
      "id": "hx_pain_character",
      "disclosure": "on_ask",
      "text": "\"It feels like an elephant is sitting on my chest.\" The pain radiates to the left arm and jaw, with nausea. It started at rest and has been constant."
    },
    {
      "id": "hx_risk_factors",
      "disclosure": "on_ask",
      "text": "He smokes about a pack a day (25 years) and takes amlodipine for hypertension. His father had a heart attack at 60."
    },
    {
      "id": "hx_safety_negatives",
      "disclosure": "on_ask",
      "text": "No prior stroke or TIA. No recent surgery, trauma, or bleeding. No erectile-dysfunction medication use."
    },
    {
      "id": "hx_allergies",
      "disclosure": "on_ask",
      "text": "No known drug allergies."
    },
    {
      "id": "ecg_tracing",
      "disclosure": "on_order_result",
      "text": "12-lead ECG acquired — the tracing is available to review."
    },
    {
      "id": "troponin_result",
      "disclosure": "on_order_result",
      "text": "hs-troponin (drawn at presentation): elevated above the 99th percentile reference limit."
    },
    {
      "id": "labs_result",
      "disclosure": "on_order_result",
      "text": "Baseline labs: no critical abnormalities reported."
    },
    {
      "id": "cxr_result",
      "disclosure": "on_order_result",
      "text": "Portable chest X-ray: no acute cardiopulmonary process reported."
    },
    {
      "id": "cath_response",
      "disclosure": "on_order_result",
      "text": "Interventional cardiology: \"Accepted — cath lab team activating, ready in about 15 minutes.\""
    }
  ],
  "availableActions": [
    {
      "id": "focused_history",
      "type": "communication",
      "label": "Take a focused history",
      "timeCostSec": 45,
      "visibility": "always",
      "visibleWhen": null,
      "preconditions": [],
      "params": [],
      "effects": [
        { "op": "disclose", "factId": "hx_pain_character" },
        { "op": "disclose", "factId": "hx_risk_factors" },
        { "op": "disclose", "factId": "hx_safety_negatives" }
      ],
      "resultTemplateId": null,
      "criterionIds": ["c_focused_history"]
    },
    {
      "id": "ask_allergies",
      "type": "communication",
      "label": "Ask about allergies",
      "timeCostSec": 15,
      "visibility": "always",
      "visibleWhen": null,
      "preconditions": [],
      "params": [],
      "effects": [{ "op": "disclose", "factId": "hx_allergies" }],
      "resultTemplateId": null,
      "criterionIds": []
    },
    {
      "id": "reassure_patient",
      "type": "communication",
      "label": "Explain and reassure",
      "timeCostSec": 20,
      "visibility": "always",
      "visibleWhen": null,
      "preconditions": [],
      "params": [],
      "effects": [{ "op": "setFlag", "flag": "reassured" }],
      "resultTemplateId": "reassured_note",
      "criterionIds": []
    },
    {
      "id": "record_differential",
      "type": "communication",
      "label": "Record working differential",
      "timeCostSec": 20,
      "visibility": "always",
      "visibleWhen": null,
      "preconditions": [],
      "params": [],
      "effects": [{ "op": "setFlag", "flag": "differential_recorded" }],
      "resultTemplateId": "ddx_recorded",
      "criterionIds": []
    },
    {
      "id": "attach_monitor",
      "type": "examine",
      "label": "Attach monitor + defib pads",
      "timeCostSec": 20,
      "visibility": "always",
      "visibleWhen": null,
      "preconditions": [],
      "params": [],
      "effects": [{ "op": "setFlag", "flag": "monitor_on" }],
      "resultTemplateId": "monitor_attached",
      "criterionIds": ["c_early_monitoring"]
    },
    {
      "id": "exam_cardiac",
      "type": "examine",
      "label": "Cardiac examination",
      "timeCostSec": 30,
      "visibility": "always",
      "visibleWhen": null,
      "preconditions": [],
      "params": [],
      "effects": [],
      "resultTemplateId": "exam_cardiac_findings",
      "criterionIds": [],
      "repeatable": true
    },
    {
      "id": "exam_lungs",
      "type": "examine",
      "label": "Lung examination",
      "timeCostSec": 30,
      "visibility": "always",
      "visibleWhen": null,
      "preconditions": [],
      "params": [],
      "effects": [],
      "resultTemplateId": "exam_lungs_findings",
      "criterionIds": [],
      "repeatable": true
    },
    {
      "id": "ecg_12lead",
      "type": "order",
      "label": "Obtain a 12-lead ECG",
      "timeCostSec": 60,
      "visibility": "always",
      "visibleWhen": null,
      "preconditions": [],
      "params": [],
      "effects": [
        { "op": "setFlag", "flag": "ecg_done" },
        { "op": "disclose", "factId": "ecg_tracing" }
      ],
      "resultTemplateId": "ecg_result",
      "criterionIds": ["c_time_to_ecg"]
    },
    {
      "id": "iv_access",
      "type": "procedure",
      "label": "Obtain IV access",
      "timeCostSec": 60,
      "visibility": "always",
      "visibleWhen": null,
      "preconditions": [],
      "params": [],
      "effects": [{ "op": "setFlag", "flag": "iv_access" }],
      "resultTemplateId": null,
      "criterionIds": ["c_iv_access"]
    },
    {
      "id": "order_troponin",
      "type": "order",
      "label": "Send hs-troponin",
      "timeCostSec": 20,
      "visibility": "always",
      "visibleWhen": null,
      "preconditions": [],
      "params": [],
      "effects": [{ "op": "setFlag", "flag": "troponin_sent" }],
      "resultTemplateId": "troponin_pending",
      "criterionIds": []
    },
    {
      "id": "order_baseline_labs",
      "type": "order",
      "label": "Send baseline labs",
      "timeCostSec": 20,
      "visibility": "always",
      "visibleWhen": null,
      "preconditions": [],
      "params": [],
      "effects": [{ "op": "setFlag", "flag": "labs_sent" }],
      "resultTemplateId": "labs_sent_note",
      "criterionIds": []
    },
    {
      "id": "cxr_portable",
      "type": "order",
      "label": "Order portable chest X-ray",
      "timeCostSec": 30,
      "visibility": "always",
      "visibleWhen": null,
      "preconditions": [],
      "params": [],
      "effects": [{ "op": "setFlag", "flag": "cxr_ordered" }],
      "resultTemplateId": "cxr_ordered_note",
      "criterionIds": []
    },
    {
      "id": "give_aspirin",
      "type": "medication",
      "label": "Aspirin 300 mg — chewed",
      "timeCostSec": 20,
      "visibility": "always",
      "visibleWhen": null,
      "preconditions": [],
      "params": [],
      "effects": [{ "op": "setFlag", "flag": "asa_given" }],
      "resultTemplateId": "aspirin_given",
      "criterionIds": ["c_aspirin_loading"]
    },
    {
      "id": "give_ticagrelor",
      "type": "medication",
      "label": "Ticagrelor 180 mg — loading dose",
      "timeCostSec": 20,
      "visibility": "always",
      "visibleWhen": null,
      "preconditions": ["flag('ecg_done')"],
      "params": [],
      "effects": [{ "op": "setFlag", "flag": "p2y12_given" }],
      "resultTemplateId": "ticagrelor_given",
      "criterionIds": ["c_p2y12_loading"]
    },
    {
      "id": "give_prasugrel",
      "type": "medication",
      "label": "Prasugrel 60 mg — loading dose",
      "timeCostSec": 20,